{
  "schema_version": "0.1",
  "episode_id": "s07_ep1",
  "session_id": "s07",
  "timestamp_start": "2026-01-15T10:33:15Z",
  "timestamp_end": "2026-01-15T10:34:20Z",
  "trigger": {
    "trigger_type": "INCONSISTENCY",
    "threshold": 0.1,
    "observed_value": 0.02,
    "trigger_rule_id": "T7"
  },
  "evidence": [
    {
      "fact": "Trigger detected",
      "value": {
        "trigger_type": "INCONSISTENCY",
        "rule_id": "T7",
        "threshold": 0.1,
        "observed_value": 0.02
      },
      "window": "episode",
      "source_event_type": "TRIGGER_DETECTED",
      "source_event_ids": [
        "e04"
      ]
    },
    {
      "fact": "Diagnosis selected",
      "value": {
        "hypothesis": "DISENGAGEMENT",
        "confidence": 0.6,
        "rule_id": "D8",
        "details": {
          "reason": "stagnation_loop"
        }
      },
      "window": "episode",
      "source_event_type": "DIAGNOSIS_SELECTED",
      "source_event_ids": [
        "e05"
      ]
    },
    {
      "fact": "Recovery action selected",
      "value": {
        "action_type": "HINT",
        "parameters": {
          "hint_level": "step_by_step",
          "concept": "loop_invariants"
        },
        "rule_id": "R10"
      },
      "window": "episode",
      "source_event_type": "RECOVERY_SELECTED",
      "source_event_ids": [
        "e06"
      ]
    },
    {
      "fact": "Post-check performed",
      "value": {
        "metric": "learning_gain_last_10",
        "value": 0.12,
        "details": {
          "window": "last_10"
        }
      },
      "window": "episode",
      "source_event_type": "POST_CHECK",
      "source_event_ids": [
        "e09"
      ]
    },
    {
      "fact": "Wrong answers in last 3 items",
      "value": 2,
      "window": "last_3",
      "source_event_type": "ANSWER_RECORDED",
      "source_event_ids": [
        "e08"
      ]
    }
  ],
  "diagnosis": {
    "hypothesis": "DISENGAGEMENT",
    "confidence": 0.6,
    "diagnosis_rule_id": "D8"
  },
  "recovery_action": {
    "action_type": "HINT",
    "parameters": {
      "hint_level": "step_by_step",
      "concept": "loop_invariants"
    },
    "action_rule_id": "R10"
  },
  "expected_effect": {
    "metric": "learning_gain_last_10",
    "target_direction": "UP",
    "check_after_steps": 2
  },
  "explanation": {
    "teacher_summary": "The system detected little learning progress over several steps. It provided a guided hint to help the student unblock, then will re-check progress.",
    "technical_trace": "Trigger T7 fired: INCONSISTENCY observed=0.02 threshold=0.1. Diagnosis D8: DISENGAGEMENT (0.6). Actions: R10: HINT({'hint_level': 'step_by_step', 'concept': 'loop_invariants'}). Post-check: learning_gain_last_10=0.12."
  },
  "audit": {
    "orchestrator": {
      "name": "SelfHealingOrchestrator",
      "version": "0.1"
    },
    "agents_involved": [
      {
        "agent_name": "diagnose_agent",
        "agent_role": "diagnosis",
        "agent_version": null
      },
      {
        "agent_name": "monitor_agent",
        "agent_role": "monitoring",
        "agent_version": null
      },
      {
        "agent_name": "orchestrator",
        "agent_role": "orchestration",
        "agent_version": null
      },
      {
        "agent_name": "recovery_agent",
        "agent_role": "recovery",
        "agent_version": null
      }
    ],
    "source_event_range": {
      "first_event_id": "e04",
      "last_event_id": "e09"
    },
    "hashes": {
      "log_sha256": "71131d6728125dbd684e0d3792abbec2e659a55650e97132742de52964367f17",
      "explanation_sha256": "ca79f07f20d18088f05e786f32a4559670f4b92ba6cddbf3e0097464b230d8c7"
    },
    "notes": "scenario_file=s07_stagnation_switch_strategy_events.jsonl"
  }
}
