{
  "schema_version": "0.1",
  "episode_id": "s02_ep1",
  "session_id": "s02",
  "timestamp_start": "2026-01-15T10:07:42Z",
  "timestamp_end": "2026-01-15T10:09:15Z",
  "trigger": {
    "trigger_type": "UNCERTAINTY_SPIKE",
    "threshold": 0.5,
    "observed_value": 0.75,
    "trigger_rule_id": "T2"
  },
  "evidence": [
    {
      "fact": "Trigger detected",
      "value": {
        "trigger_type": "UNCERTAINTY_SPIKE",
        "rule_id": "T2",
        "threshold": 0.5,
        "observed_value": 0.75
      },
      "window": "episode",
      "source_event_type": "TRIGGER_DETECTED",
      "source_event_ids": [
        "e05"
      ]
    },
    {
      "fact": "Diagnosis selected",
      "value": {
        "hypothesis": "DISENGAGEMENT",
        "confidence": 0.72,
        "rule_id": "D3",
        "details": {
          "pattern": "fast_responses"
        }
      },
      "window": "episode",
      "source_event_type": "DIAGNOSIS_SELECTED",
      "source_event_ids": [
        "e06"
      ]
    },
    {
      "fact": "Recovery action selected",
      "value": {
        "action_type": "EASIER_ITEMS",
        "parameters": {
          "concept": "Algebra",
          "difficulty_delta": -1,
          "n_items": 3
        },
        "rule_id": "R4"
      },
      "window": "episode",
      "source_event_type": "RECOVERY_SELECTED",
      "source_event_ids": [
        "e07"
      ]
    },
    {
      "fact": "Post-check performed",
      "value": {
        "metric": "engagement_score",
        "value": 0.62,
        "details": {
          "baseline": 0.31
        }
      },
      "window": "episode",
      "source_event_type": "POST_CHECK",
      "source_event_ids": [
        "e11"
      ]
    },
    {
      "fact": "Wrong answers in last 5 items",
      "value": 2,
      "window": "last_5",
      "source_event_type": "ANSWER_RECORDED",
      "source_event_ids": [
        "e10"
      ]
    }
  ],
  "diagnosis": {
    "hypothesis": "DISENGAGEMENT",
    "confidence": 0.72,
    "diagnosis_rule_id": "D3"
  },
  "recovery_action": {
    "action_type": "EASIER_ITEMS",
    "parameters": {
      "concept": "Algebra",
      "difficulty_delta": -1,
      "n_items": 3
    },
    "action_rule_id": "R4"
  },
  "expected_effect": {
    "metric": "engagement_score",
    "target_direction": "UP",
    "check_after_steps": 3
  },
  "explanation": {
    "teacher_summary": "The system detected signs of guessing/low engagement on Algebra. It temporarily switched to easier items (3 question(s)) to re-stabilize performance and attention.",
    "technical_trace": "Trigger T2 fired: UNCERTAINTY_SPIKE observed=0.75 threshold=0.5. Diagnosis D3: DISENGAGEMENT (0.72). Actions: R4: EASIER_ITEMS({'concept': 'Algebra', 'difficulty_delta': -1, 'n_items': 3}). Post-check: engagement_score=0.62."
  },
  "audit": {
    "orchestrator": {
      "name": "SelfHealingOrchestrator",
      "version": "0.1"
    },
    "agents_involved": [
      {
        "agent_name": "diagnose_agent",
        "agent_role": "diagnosis",
        "agent_version": null
      },
      {
        "agent_name": "monitor_agent",
        "agent_role": "monitoring",
        "agent_version": null
      },
      {
        "agent_name": "orchestrator",
        "agent_role": "orchestration",
        "agent_version": null
      },
      {
        "agent_name": "recovery_agent",
        "agent_role": "recovery",
        "agent_version": null
      }
    ],
    "source_event_range": {
      "first_event_id": "e05",
      "last_event_id": "e11"
    },
    "hashes": {
      "log_sha256": "542a8f1b0e5fba4022a97911bad850e71601b1be3763319d3d1bf5630b8b7d2a",
      "explanation_sha256": "e3236f3c270447c14d8edeba3a3d7f4199bc2c6200849890c074ef3084ca2398"
    },
    "notes": "scenario_file=s02_disengagement_events.jsonl"
  }
}
