{
  "schema_version": "0.1",
  "episode_id": "s06_ep1",
  "session_id": "s06",
  "timestamp_start": "2026-01-15T10:27:35Z",
  "timestamp_end": "2026-01-15T10:28:25Z",
  "trigger": {
    "trigger_type": "CONFLICTING_RECOMMENDATIONS",
    "threshold": 0.65,
    "observed_value": 0.78,
    "trigger_rule_id": "T6"
  },
  "evidence": [
    {
      "fact": "Trigger detected",
      "value": {
        "trigger_type": "CONFLICTING_RECOMMENDATIONS",
        "rule_id": "T6",
        "threshold": 0.65,
        "observed_value": 0.78
      },
      "window": "episode",
      "source_event_type": "TRIGGER_DETECTED",
      "source_event_ids": [
        "e04"
      ]
    },
    {
      "fact": "Diagnosis selected",
      "value": {
        "hypothesis": "UNKNOWN",
        "confidence": 0.55,
        "rule_id": "D7",
        "details": {
          "reason": "no_clear_best_action"
        }
      },
      "window": "episode",
      "source_event_type": "DIAGNOSIS_SELECTED",
      "source_event_ids": [
        "e05"
      ]
    },
    {
      "fact": "Recovery action selected",
      "value": {
        "action_type": "CIRCUIT_BREAK",
        "parameters": {
          "policy": "majority_vote",
          "tie_breaker": "orchestrator_default"
        },
        "rule_id": "R9"
      },
      "window": "episode",
      "source_event_type": "RECOVERY_SELECTED",
      "source_event_ids": [
        "e06"
      ]
    },
    {
      "fact": "Post-check performed",
      "value": {
        "metric": "conflict_score",
        "value": 0.1,
        "details": {
          "window": "current_step"
        }
      },
      "window": "episode",
      "source_event_type": "POST_CHECK",
      "source_event_ids": [
        "e08"
      ]
    },
    {
      "fact": "Wrong answers in last 1 items",
      "value": 1,
      "window": "last_1",
      "source_event_type": "ANSWER_RECORDED",
      "source_event_ids": [
        "e01"
      ]
    }
  ],
  "diagnosis": {
    "hypothesis": "UNKNOWN",
    "confidence": 0.55,
    "diagnosis_rule_id": "D7"
  },
  "recovery_action": {
    "action_type": "CIRCUIT_BREAK",
    "parameters": {
      "policy": "majority_vote",
      "tie_breaker": "orchestrator_default"
    },
    "action_rule_id": "R9"
  },
  "expected_effect": {
    "metric": "conflict_score",
    "target_direction": "DOWN",
    "check_after_steps": 2
  },
  "explanation": {
    "teacher_summary": "Multiple agents recommended different actions at the same time. The system applied an arbitration rule to choose a safe next step, then will monitor if conflicts reduce.",
    "technical_trace": "Trigger T6 fired: CONFLICTING_RECOMMENDATIONS observed=0.78 threshold=0.65. Diagnosis D7: UNKNOWN (0.55). Actions: R9: CIRCUIT_BREAK({'policy': 'majority_vote', 'tie_breaker': 'orchestrator_default'}). Post-check: conflict_score=0.1."
  },
  "audit": {
    "orchestrator": {
      "name": "SelfHealingOrchestrator",
      "version": "0.1"
    },
    "agents_involved": [
      {
        "agent_name": "diagnose_agent",
        "agent_role": "diagnosis",
        "agent_version": null
      },
      {
        "agent_name": "monitor_agent",
        "agent_role": "monitoring",
        "agent_version": null
      },
      {
        "agent_name": "orchestrator",
        "agent_role": "orchestration",
        "agent_version": null
      },
      {
        "agent_name": "recovery_agent",
        "agent_role": "recovery",
        "agent_version": null
      }
    ],
    "source_event_range": {
      "first_event_id": "e04",
      "last_event_id": "e08"
    },
    "hashes": {
      "log_sha256": "94fc3b88fdd709d7a3e5080703441acaef7146a7881982b0b0a208e32270d0a5",
      "explanation_sha256": "d2321c16fd1d9ba0077c03cb1068d7b4ef8450a44ec523a0d76bfeac14a07677"
    },
    "notes": "scenario_file=s06_conflicting_recommendations_arbitration_events.jsonl"
  }
}
