{
  "schema_version": "0.1",
  "episode_id": "s08_ep1",
  "session_id": "s08",
  "timestamp_start": "2026-01-15T10:37:35Z",
  "timestamp_end": "2026-01-15T10:38:40Z",
  "trigger": {
    "trigger_type": "UNCERTAINTY_SPIKE",
    "threshold": 0.6,
    "observed_value": 0.82,
    "trigger_rule_id": "T8"
  },
  "evidence": [
    {
      "fact": "Trigger detected",
      "value": {
        "trigger_type": "UNCERTAINTY_SPIKE",
        "rule_id": "T8",
        "threshold": 0.6,
        "observed_value": 0.82
      },
      "window": "episode",
      "source_event_type": "TRIGGER_DETECTED",
      "source_event_ids": [
        "e03"
      ]
    },
    {
      "fact": "Diagnosis selected",
      "value": {
        "hypothesis": "DATA_QUALITY",
        "confidence": 0.68,
        "rule_id": "D9",
        "details": {
          "signal": "data_noise_score"
        }
      },
      "window": "episode",
      "source_event_type": "DIAGNOSIS_SELECTED",
      "source_event_ids": [
        "e04"
      ]
    },
    {
      "fact": "Recovery action selected",
      "value": {
        "action_type": "DIAGNOSTIC_ITEM",
        "parameters": {
          "purpose": "confirm_noise",
          "n_items": 1,
          "concept": "Sanity-check question"
        },
        "rule_id": "R11"
      },
      "window": "episode",
      "source_event_type": "RECOVERY_SELECTED",
      "source_event_ids": [
        "e05"
      ]
    },
    {
      "fact": "Post-check performed",
      "value": {
        "metric": "data_noise_score",
        "value": 0.4,
        "details": {
          "source": "input_stream"
        }
      },
      "window": "episode",
      "source_event_type": "POST_CHECK",
      "source_event_ids": [
        "e08"
      ]
    },
    {
      "fact": "Wrong answers in last 2 items",
      "value": 0,
      "window": "last_2",
      "source_event_type": "ANSWER_RECORDED",
      "source_event_ids": [
        "e07"
      ]
    }
  ],
  "diagnosis": {
    "hypothesis": "DATA_QUALITY",
    "confidence": 0.68,
    "diagnosis_rule_id": "D9"
  },
  "recovery_action": {
    "action_type": "DIAGNOSTIC_ITEM",
    "parameters": {
      "purpose": "confirm_noise",
      "n_items": 1,
      "concept": "Sanity-check question"
    },
    "action_rule_id": "R11"
  },
  "expected_effect": {
    "metric": "data_noise_score",
    "target_direction": "DOWN",
    "check_after_steps": 1
  },
  "explanation": {
    "teacher_summary": "The system detected noisy/unstable signals. It ran a short confirmatory check to verify the situation before changing the learning path.",
    "technical_trace": "Trigger T8 fired: UNCERTAINTY_SPIKE observed=0.82 threshold=0.6. Diagnosis D9: DATA_QUALITY (0.68). Actions: R11: DIAGNOSTIC_ITEM({'purpose': 'confirm_noise', 'n_items': 1, 'concept': 'Sanity-check question'}). Post-check: data_noise_score=0.4."
  },
  "audit": {
    "orchestrator": {
      "name": "SelfHealingOrchestrator",
      "version": "0.1"
    },
    "agents_involved": [
      {
        "agent_name": "diagnose_agent",
        "agent_role": "diagnosis",
        "agent_version": null
      },
      {
        "agent_name": "monitor_agent",
        "agent_role": "monitoring",
        "agent_version": null
      },
      {
        "agent_name": "orchestrator",
        "agent_role": "orchestration",
        "agent_version": null
      },
      {
        "agent_name": "recovery_agent",
        "agent_role": "recovery",
        "agent_version": null
      }
    ],
    "source_event_range": {
      "first_event_id": "e03",
      "last_event_id": "e08"
    },
    "hashes": {
      "log_sha256": "2d8560ac2c93ede3de4d721b967bd71289ccd26ae896fff496737a91e0104d56",
      "explanation_sha256": "0ac074e22b10ccb4defaa0bb792a85439a8da63bd4b008b5683da7645d601c9d"
    },
    "notes": "scenario_file=s08_noise_burst_confirmatory_check_events.jsonl"
  }
}
